name,role,company,industry,location,linkedin_bio
Ava Patel,Head of Growth,FlowMetrics,SaaS,San Francisco,Seasoned leader with a focus on scaling SaaS companies.
Bob Johnson,CEO,Innovate Corp,B2B SaaS mid-market,New York,Experienced founder of B2B SaaS companies.
Jane Smith,Influencer,Marketing Hub,Marketing,New York,Digital strategist and content creator.
Emily Davis,Software Engineer,Tech Solutions,Finance,Bengaluru,Passionate about building robust backend systems.
Michael Brown,Product Manager,Productivity Co.,Retail,Chicago,Driving product innovation from concept to launch.